"","video_id","publishedAt","title","description","id","viewCount","likeCount","favoriteCount","commentCount"
"362","hNLAG8kHQuM",2022-08-16,"NYT CAUGHT Hiding Conflict Of Interest In Endorsement | Breaking Points with Krystal and Saagar","Krystal and Saagar reveal the conflict of interest left out of the New York Times' endorsement of NY-10 congressional candidate ...","hNLAG8kHQuM",45095,1490,0,148
"363","Of_lNH_Ie-Q",2022-08-17,"REACTION: Liz Cheney CLOBBERED As She Floats 2024 Run | Breaking Points with Krystal and Saagar","Krystal and Saagar react to Liz Cheney's overwhelming defeat in the Wyoming GOP primary and the possibility she runs in 2024 ...","Of_lNH_Ie-Q",153310,4959,0,1811
"364","M6-P_vdua-s",2022-08-22,"Brian Stelter&#39;s HUMILIATING Finish After CNN Firing | Breaking Points with Krystal and Saagar","Krystal and Saagar present viewers with the news about Brian Stelter getting fired from CNN and his humiliating final show To ...","M6-P_vdua-s",30382,3280,0,556
"365","J-b_sOvock4",2022-08-21,"Can Americans TRUST The IRS? | Breaking Points with Krystal and Saagar","Krystal and Saagar consider whether regular Americans can trust the revamped IRS not to go after them with their new funds and ...","J-b_sOvock4",55539,2108,0,667
"366","Q1QME3rBAYk",2022-08-18,"Saagar Enjeti: GOP Is The MAGA Party. Enough With Cheney Delusions","Saagar dives into why conservatives should stop deluding themselves and accept that the GOP is simply the party of Trump ...","Q1QME3rBAYk",77096,2750,0,1079
"367","sRilZ0P5814",2022-08-18,"Pence BLASTS GOP Calls To Defund FBI | Breaking Points with Krystal and Saagar","Krystal and Saagar deliberate on the comments made by Mike Pence about GOP calls to defund the FBI that represent another ...","sRilZ0P5814",47729,1360,0,418
"368","dC4koqHzR_U",2022-08-22,"Trump May DELAY 2024 Announcement Amid McConnell WAR | Breaking Points with Krystal and Saagar","Krystal and Saagar weigh in on the reports about Trump delaying his 2024 campaign announcement until after the midterms amid ...","dC4koqHzR_U",11256,550,0,63
"369","6NrDflzzhtA",2022-08-18,"Liz Cheney Likens Herself To LINCOLN In Potential 2024 Bid | Breaking Points with Krystal and Saagar","Krystal and Saagar expand on the Liz Cheney primary defeat and rebuke her speech comparing herself to Abraham Lincoln To ...","6NrDflzzhtA",35636,1225,0,291
"370","K4VZj08_Kms",2022-08-13,"POLL: Biden Underwater On Inflation, Economic Recovery | Breaking Points with Krystal and Saagar","Krystal and Saagar review a new poll on the issues showing Joe Biden with over 60 percent disapproval on inflation, economic ...","K4VZj08_Kms",49289,1729,0,470
"371","-P6GFmNAc6w",2022-08-20,"Sinema&#39;s SHAMELESS Wall Street Giveaway In Biden Bill | Breaking Points with Krystal and Saagar","Krystal converses with The Lever journalist David Sirota about Biden's so-called Inflation Reduction Act and the Wall Street ...","-P6GFmNAc6w",40104,1670,0,470
"372","q0Y95Rsy9UQ",2022-08-18,"Ryan And Emily SOUND OFF On 2022 Midterm Chances | Breaking Points with Krystal and Saagar","Krystal and Saagar are joined by political commentators Ryan Grim and Emily Jashinsky to talk in depth about the 2022 midterm ...","q0Y95Rsy9UQ",56633,2184,0,564
"373","2KjilYIY7m8",2022-08-22,"DETAILS: Putin Ally ASSASSINATED In Moscow | Breaking Points with Krystal and Saagar","Krystal and Saagar dive into the assassination of a philosopher and close Putin ally that could escalate the Russian war against ...","2KjilYIY7m8",21103,1198,0,294
"374","XxVvtI33pwM",2022-08-22,"Are Polls RIGGED In Dem Favor? | Breaking Points with Krystal and Saagar","Krystal and Saagar reflect on past election outcomes and consider whether polls are rigged in favor of Democrats To become a ...","XxVvtI33pwM",8730,499,0,142
"375","9_4oUO76Zyw",2022-08-22,"GOP CIVIL WAR As Tucker, Hannity Point Fingers On Bad Polls |Breaking Points with Krystal and Saagar","Krystal and Saagar watch the GOP civil war playing out between the party leadership and Fox News anchors Sean Hannity and ...","9_4oUO76Zyw",15192,768,0,180
"376","0h5yeDPza8A",2022-08-22,"Dem Midterm Chances SKYROCKET After Abortion Decision | Breaking Points with Krystal and Saagar","Krystal and Saagar analyze how the SCOTUS abortion decision has boosted Dems midterm chances by rallying the base and ...","0h5yeDPza8A",11079,627,0,234
"377","Mrjf9kHLWgI",2022-08-20,"Rogan Has HEATED DEBATE on Abortion | Breaking Points with Krystal and Saagar","Krystal and Saagar cover the heated debate between Joe Rogan and a guest on his show about abortion To become a Breaking ...","Mrjf9kHLWgI",149097,4060,0,3572
"378","snJhj3nbvJk",2022-08-21,"Krystal and Saagar DEBATE Why Trump Took Classified Docs | Breaking Points with Krystal and Saagar","Krystal and Saagar debate the two proposed reasons as to why Trump took classified documents from the White House to his ...","snJhj3nbvJk",46214,1240,0,812
"379","UU_dJUfoqFE",2022-07-07,"Dem Insiders FREAK At Incompetent Biden | Breaking Points with Krystal and Saagar","Krystal and Saagar look at the reporting from inside Democratic party circles and the Biden administration with top officials ...","UU_dJUfoqFE",190932,6855,0,1614
"380","5kQ6gzx5QZA",2022-07-19,"Disinfo Czar DENIES Disinfo To CNN&#39;s Brian Stelter | Breaking Points with Krystal and Saagar","Krystal and Saagar show viewers how the infamous 'disinfo' czar Nina Jankowicz responded to attacks on her for her own ...","5kQ6gzx5QZA",140992,5309,0,604
"381","e45d2Lo85t0",2022-07-25,"Pelosi DENIES Insider Trading As Husband Trades Millions | Breaking Points with Krystal and Saagar","Krystal and Saagar scrutinize the stock trades by Nancy Pelosi's husband ahead of a big vote on semiconductor legislation To ...","e45d2Lo85t0",110180,5088,0,995
"382","gKgYZNqcoZ8",2022-07-27,"Kamala Speechwriter FLEES After Disastrous 4 Months | Breaking Points with Krystal and Saagar","Krystal and Saagar update viewers on the staff turnover in Vice President Kamala Harris' office after her speechwriter left only 4 ...","gKgYZNqcoZ8",132204,5344,0,807
"383","nbvRngeLr9I",2022-06-13,"Taylor Lorenz CAUGHT In ANOTHER LIE | Breaking Points with Krystal and Saagar","Krystal and Saagar examine the latest lie engulfing Taylor Lorenz after she scapegoated her editor for a mistake in her recent ...","nbvRngeLr9I",187873,5983,0,807
"384","YtEBZhdVzW0",2022-07-21,"News Companies Continue To TANK Without Trump | Breaking Points with Krystal and Saagar","Krystal and Saagar analyze the drop in engagement seen by media of all different forms after Trump despite the newsworthy ...","YtEBZhdVzW0",108708,4932,0,807
"385","kN0uYYvX-RE",2022-06-23,"PROOF: Cops Could Have Stopped Uvalde Shooting In &#39;THREE MINUTES&#39; | Breaking Points","Krystal and Saagar provide viewers with the latest revelations concerning the Uvalde shooting that show how cops could have ...","kN0uYYvX-RE",104820,4980,0,1162
"386","gSbpfdtNcyg",2022-04-26,"REVEALED: Kamala Taps MORNING JOE For Political Advice | Breaking Points with Krystal and Saagar","Krystal and Saagar look at the collapse of Kamala Harris's inner circle and the new people she is turning to for advice such as ...","gSbpfdtNcyg",112032,3837,0,674
"387","MdgqTm4Aqqo",2022-05-31,"Is Pelosi BLOCKING Stock Trading Ban For Congress? | Breaking Points with Krystal and Saagar","Krystal and Saagar update viewers on the stock ban negotiations in Congress that have stalled behind the scenes in large part ...","MdgqTm4Aqqo",65436,2919,0,432
"388","C_7lv56C-Dk",2022-05-20,"Alternative World Hillary Series REJECTED By Hulu | Breaking Points with Krystal and Saagar","Krystal and Saagar look at the rejection by Hulu of a proposed show where Hillary Clinton lives an alternative life without every ...","C_7lv56C-Dk",88960,3787,0,542
"389","QrYrgYeCBno",2022-05-27,"Southern Baptists ROCKED By BOMBSHELL Sexual Assault Coverup | Breaking Points","Krystal and Saagar cover the bombshell coverup of sexual assault by the Southern Baptist Church that has rocked the institution ...","QrYrgYeCBno",71816,2838,0,789
"390","rLuS4Abn9ZE",2022-06-09,"Uvalde Teacher BLASTS Police: &quot;I Will Never Forgive&#39; | Breaking Points with Krystal and Saagar","Krystal and Saagar cover the harrowing stories from the Uvalde shooting survivors as the police coverup of their misconduct ...","rLuS4Abn9ZE",58605,2667,0,467
"391","YfRYRqMkGUI",2022-06-26,"John Mearsheimer&#39;s PRESCIENT Warning Of Ukraine War | Breaking Points with Krystal and Saagar","Krystal and Saagar analyze the prophetic warning made by Professor John Mearsheimer of war between Russia and Ukraine ...","YfRYRqMkGUI",125392,4496,0,1429
"392","cJW5myZATJM",2022-08-04,"Saagar Enjeti: Dave Portnoy Was RIGHT About GOP And Abortion","Saagar revisits the Barstool Conservatism thesis and Dave Portnoy's comments on abortion after the GOP was strongly defeated ...","cJW5myZATJM",181798,5605,0,1448
"393","XPjBa8-_V6c",2022-08-08,"China REFUSES US Phone Calls Amid Military Drills | Breaking Points with Krystal and Saagar","Krystal and Saagar cover the escalation by China after Nancy Pelosi's trip to Taiwan that saw Beijing embark on unprecedented ...","XPjBa8-_V6c",108693,3577,0,1230
"394","Qd8mBexAbkU",2022-05-23,"Krystal Ball: Dem Party DESTROYED By Consultant Swamp ROT","Krystal explains why the Democrats need to drain the swamp in their party and get rid of the permanent class of corporate backed ...","Qd8mBexAbkU",83822,3904,0,573
"395","IdohFjBoyJc",2022-03-17,"Krystal Ball: Bill Burr DESTROYS Corrupt Politicians for Gas Prices","Krystal breaks down the lies being told by big oil companies and their political allies about why gas prices are so high as was ...","IdohFjBoyJc",256645,12589,0,2107
"396","sBFJVXoTgrk",2022-08-04,"RED STATE SHOCK: Voters Overwhelmingly Reject Abortion Ban | Breaking Points with Krystal and Saagar","Krystal and Saagar bring the results of the Kansas abortion referendum that saw voters reject the chance of an abortion ban ...","sBFJVXoTgrk",117061,3900,0,1703
"397","wrOOlZfxBdA",2022-05-27,"Kellyanne Conway BLASTS HUSBAND, Jared Kushner In New Book | Breaking Points with Krystal and Saagar","Krystal and Saagar react to comments made by Kellyanne Conway in her new book about Jared Kushner's role in the White ...","wrOOlZfxBdA",67221,1975,0,349
"398","Y4N_a-dS7vM",2022-07-11,"Top Anti-War Think Tank DEFENDS Stance On Ukraine | Breaking Points with Krystal and Saagar","Krystal and Saagar evaluate the lack of dissent from US foreign policy on Ukraine and the fallout suffered by a top anti-war think ...","Y4N_a-dS7vM",43424,1813,0,451
"399","U8Cq4EKwD_Y",2022-08-14,"Is The GOP ALL TALK On Going After FBI? | Breaking Points with Krystal and Saagar","Krystal and Saagar consider whether America needs a new Church Committee to check the FBI's power and if the GOP is serious ...","U8Cq4EKwD_Y",50906,1686,0,549
"400","_-Jq43h1qkc",2022-05-23,"Will Establishment Dems Suffer Another DEVASTATING BLOW In TX Primary? | Breaking Points","Krystal and Saagar go through the competitive Democratic primary in Texas between establishment incumbent Henry Cuellar and ...","_-Jq43h1qkc",52404,1907,0,286
"401","Qd8mBexAbkU",2022-05-23,"Krystal Ball: Dem Party DESTROYED By Consultant Swamp ROT","Krystal explains why the Democrats need to drain the swamp in their party and get rid of the permanent class of corporate backed ...","Qd8mBexAbkU",83822,3904,0,573
"402","IdohFjBoyJc",2022-03-17,"Krystal Ball: Bill Burr DESTROYS Corrupt Politicians for Gas Prices","Krystal breaks down the lies being told by big oil companies and their political allies about why gas prices are so high as was ...","IdohFjBoyJc",256645,12589,0,2107
"403","sBFJVXoTgrk",2022-08-04,"RED STATE SHOCK: Voters Overwhelmingly Reject Abortion Ban | Breaking Points with Krystal and Saagar","Krystal and Saagar bring the results of the Kansas abortion referendum that saw voters reject the chance of an abortion ban ...","sBFJVXoTgrk",117061,3900,0,1703
"404","wrOOlZfxBdA",2022-05-27,"Kellyanne Conway BLASTS HUSBAND, Jared Kushner In New Book | Breaking Points with Krystal and Saagar","Krystal and Saagar react to comments made by Kellyanne Conway in her new book about Jared Kushner's role in the White ...","wrOOlZfxBdA",67221,1975,0,349
"405","Y4N_a-dS7vM",2022-07-11,"Top Anti-War Think Tank DEFENDS Stance On Ukraine | Breaking Points with Krystal and Saagar","Krystal and Saagar evaluate the lack of dissent from US foreign policy on Ukraine and the fallout suffered by a top anti-war think ...","Y4N_a-dS7vM",43424,1813,0,451
"406","U8Cq4EKwD_Y",2022-08-14,"Is The GOP ALL TALK On Going After FBI? | Breaking Points with Krystal and Saagar","Krystal and Saagar consider whether America needs a new Church Committee to check the FBI's power and if the GOP is serious ...","U8Cq4EKwD_Y",50906,1686,0,549
"407","_-Jq43h1qkc",2022-05-23,"Will Establishment Dems Suffer Another DEVASTATING BLOW In TX Primary? | Breaking Points","Krystal and Saagar go through the competitive Democratic primary in Texas between establishment incumbent Henry Cuellar and ...","_-Jq43h1qkc",52404,1907,0,286
"408","OhVKc99Ko8s",2022-08-09,"LAWYER: Fact From Fiction On Trump&#39;s Legal Jeopardy | Breaking Points with Krystal and Saagar","Krystal and Saagar are joined by national security lawyer Bradley Moss to better understand legal possibilities surrounding the ...","OhVKc99Ko8s",94381,2979,0,675
"409","K_qFcp3sUh8",2022-08-11,"Trump PLEADS THE FIFTH 400 Times In Deposition | Breaking Points with Krystal and Saagar","Krystal and Saagar break down the NY AG civil investigation into Donald Trump's business practices that led to him pleading the ...","K_qFcp3sUh8",71836,2003,0,820
"410","jAwOt3DuaiE",2022-07-24,"Are Dem Elites Too Captured By Capital To Change? | Krystal Kyle &amp; Friends","Krystal talks with historian Gary Gerstle about the deep attachment between Democrats and capital that make it difficult for them to ...","jAwOt3DuaiE",56062,1977,0,655
"411","Db_3a2u32Zc",2022-06-24,"Biden Social Security Pick Wants To CUT Program | Breaking Points with Krystal and Saagar","Krystal talks to The Lever Journalist Matthew Cunningham Cook about Biden's nominee to a key board overseeing Social Security ...","Db_3a2u32Zc",55818,2141,0,725
"412","TEGs14SB5dY",2022-05-26,"Are Worldwide BREAD RIOTS Already Here? | Breaking Points with Krystal and Saagar","Krystal and Saagar are joined by commodity markets expert Rupert Russell to better understand the coming food crisis caused by ...","TEGs14SB5dY",77977,2568,0,390
"413","WrJOxg_Ye1A",2022-08-02,"Krystal Ball: Libs FREAK Over Forward Party Cringe Launch","Krystal analyzes Andrew Yang's Forward Party launch and the lessons from the liberal freakout in response to it To become a ...","WrJOxg_Ye1A",111304,4092,0,1224
"414","loZ1IufAs0M",2022-02-18,"Inside Biden&#39;s Legal FIGHT Against Student Debtors | Breaking Points with Krystal and Saagar","Krystal and Saagar talk with Daily Poster journalist Julia Rock about how the Biden administration has been fighting student ...","loZ1IufAs0M",111048,5147,0,1177
"415","R-P6Szq7DsY",2022-05-03,"Krystal Ball: SCREWED College Educated Workers EXACT REVENGE","Krystal examines the changing dynamics of the working class caused by the growth in college educated youth taking up working ...","R-P6Szq7DsY",81224,2977,0,866
"416","FgEafZWsqg8",2021-08-31,"Judge STRIPS CUSTODY From Mom For Not Being Vaccinated","Krystal and Saagar weigh in on the story of a mom losing custody of her child for not being vaccinated and other instances of the ...","FgEafZWsqg8",124941,6730,0,2090
"417","zfDMeFrXPsU",2022-08-15,"ALL Of Trump&#39;s FBI Raid Excuses Explained | Breaking Points with Krystal and Saagar","Krystal and Saagar explain all of the legal defenses and justifications of the FBI raid given by Trump now that more information ...","zfDMeFrXPsU",106357,2685,0,1509
"418","SedsLX-dFjs",2022-07-05,"WH FREAKS At New Press Sec&#39;s TERRIBLE Debut | Breaking Points with Krystal and Saagar","Krystal and Saagar give their takes on the White House's internal response to new White House Press Secretary Karine ...","SedsLX-dFjs",241800,7809,0,1714
"419","5veoGTzP-1E",2022-06-06,"Cops THREATEN Uvalde Mom For Revealing Their Mistakes | Breaking Points with Krystal and Saagar","Krystal and Saagar cover the deepening Uvalde police coverup of their misconduct during the mass shooting including threats to ...","5veoGTzP-1E",199231,10273,0,2462
"420","U5h5z7Ba1-s",2022-06-07,"Saagar Enjeti: WAPO SUSPENDS Journo For Bad Joke, Lets Taylor Lorenz LIE With No Punishment","Saagar takes viewers through the drama at the Washington Post after a journalist there amplified a bad joke leading to his ...","U5h5z7Ba1-s",143080,6329,0,1250
"421","577vd39qpvw",2022-04-11,"NYT Leadership Tells Staff To STOP TWEETING | Breaking Points with Krystal and Saagar","Krystal and Saagar examine the shakeup in social media policy at The New York Times after leadership expressed concern to ...","577vd39qpvw",79611,2784,0,216
"422","rvoLcmdMaR0",2022-05-30,"UVALDE: Cops ADMIT They Were Too Scared To Confront Gunman | Breaking Points with Krystal and Saagar","Krystal and Saagar break down the string of law enforcement failures during the Uvalde shooting that were initially lied about by ...","rvoLcmdMaR0",198829,9380,0,3013
"423","2gZBlGMxInY",2022-07-21,"NYC Releases BIZARRE Nuclear Blast Preparedness Video | Breaking Points with Krystal and Saagar","Krystal and Saagar make sense of the bizarre nuclear blast preparedness video by the NYC government To become a Breaking ...","2gZBlGMxInY",96305,3319,0,1190
"424","lIdYr-F9AIQ",2022-07-14,"LEAKED Footage Reveals Cop Cowardice In Uvalde Hallways | Breaking Points with Krystal and Saagar","Krystal and Saagar review the leaked footage from the Uvalde school hallways during the shooting showing the depths of cop ...","lIdYr-F9AIQ",109181,5138,0,1330
"425","COqMox8Q080",2022-05-24,"Netflix CANS &#39;Anti-Racist&#39; Baby, Other Woke Projects | Breaking Points with Krystal and Saagar","Krystal and Saagar discuss the reasons why Netflix has cancelled the 'anti racist' baby project and other expensive, woke content ...","COqMox8Q080",138435,4465,0,1072
"426","GNILD_mgepk",2022-08-09,"FBI RAIDS TRUMP: Everything You Need To Know | Breaking Points with Krystal and Saagar","Krystal and Saagar give viewers everything you need to know about the FBI raid of Trump's Mar-a-Lago compound in Florida in ...","GNILD_mgepk",222079,6929,0,2972
"427","3eUqPlbLWYc",2022-06-14,"Saagar Enjeti: Docs REVEAL Ministry Of Truth LIES, Twitter Collaboration","Saagar describes to viewers the findings of documents about the DHS Ministry of Truth leaked by a whistleblower revealing a ...","3eUqPlbLWYc",98993,5048,0,574
"428","H30rAuq7tbo",2022-05-17,"Elon Threatens To WALK From Twitter Deal Over Bot Count | Breaking Points with Krystal and Saagar","Krystal and Saagar consider the threats Elon Musk is making publicly about walking out of his agreed upon Twitter purchase due ...","H30rAuq7tbo",122821,3428,0,886
"429","3bnXNYbksmc",2022-03-28,"Biden&#39;s CATASTROPHIC Call For Regime Change In Russia | Breaking Points with Krystal and Saagar","Krystal and Saagar go through all of President Biden's comments about Russian President Putin and the war in Ukraine including ...","3bnXNYbksmc",159519,6530,0,2215
"430","c1rgTzMQZBc",2022-04-26,"Bernie Advisor: How Media RIGGED Race For Kamala, Biden | Breaking Points with Krystal and Saagar","Krystal and Saagar are joined by former Bernie 2020 top campaign advisor Ari Robin-Havt to get the inside story on who Sanders ...","c1rgTzMQZBc",98130,4158,0,782
"431","7RVNHcmINTU",2022-05-10,"Retailers RATION Baby Formula Amid Shortage CRISIS | Breaking Points with Krystal and Saagar","Krystal and Saagar break down the national shortage in baby formula that has become a crisis for retailers who have resorted to ...","7RVNHcmINTU",48948,1935,0,702
"432","RaVByO0lPj4",2022-08-02,"Pelosi DEFIANT: Lands In Taiwan Despite Military Warnings | Breaking Points with Krystal and Saagar","Krystal and Saagar discuss the trip Nancy Pelosi is making to Taiwan in defiance of military recommendations that is stoking ...","RaVByO0lPj4",120720,4159,0,1406
"433","1zWJuNwurXE",2022-07-24,"Is America An Empire In Decline? | Krystal Kyle &amp; Friends","Krystal talks to historian Gary Gerstle about the American empire and whether it is in decline and how this will change the world ...","1zWJuNwurXE",71051,2450,0,771
"434","fzfjyKGw49w",2022-06-02,"Biden FLIP FLOPS AGAIN On Putin Regime Change | Breaking Points with Krystal and Saagar","Krystal and Saagar analyze President Biden's op-ed on Ukraine strategy going forward as the Russians gain in the Donbas and ...","fzfjyKGw49w",56088,1838,0,450
"435","lh_Ps5wDSPQ",2022-08-16,"FBI, Media LIE About Seizing Trump Passports | Breaking Points with Krystal and Saagar","Krystal and Saagar take viewers through the Trump passport saga involving lies told by the FBI and DOJ that were pushed by the ...","lh_Ps5wDSPQ",102434,3100,0,1111
"436","aXDnOQou1po",2022-06-23,"NYT Admits Sanctions BACKFIRE As Biden Defiant On Gas | Breaking Points with Krystal and Saagar","Krystal and Saagar continue to examine the West's reckoning with the sanctions package against Russia that has skyrocketed ...","aXDnOQou1po",125085,4691,0,1229
"437","kfCMBF_72y0",2022-05-31,"Biden REJECTS Major Ukraine Weapons Request As Russia Gains Ground | Breaking Points","Krystal and Saagar provide an update on the Ukraine war that has become centered around the Russia offensive in the Donbas ...","kfCMBF_72y0",71654,2519,0,780
"438","pHTwoG11mlw",2022-07-07,"REVEALED: Dad COVERED For Highland Park Killer On Guns | Breaking Points with Krystal and Saagar","Krystal and Saagar bring viewers the latest information on the Highland Park shooting and how the gunman obtained a firearm in ...","pHTwoG11mlw",96063,3330,0,822
"439","-93trUJdhEk",2022-08-15,"Saagar Enjeti: Will Dems New IRS Agents Target Working Poor?","Saagar takes a look at the new IRS agents being hired as part of the Dems recent legislation and who will be targeted by ...","-93trUJdhEk",124869,5359,0,1102
"440","LIZIxAsuquY",2022-06-03,"Marine Corps DRAGGED for Rainbow Bullets for Pride Month | Breaking Points with Krystal and Saagar","Krystal and Saagar look at the response to the US Marine Corp posting an image of a helmet with rainbow bullets for pride month ...","LIZIxAsuquY",75805,2956,0,1005
"441","yA7B4a40GBo",2022-08-15,"Jan 6 Attendee SHOT DEAD At FBI Office As Tensions Rise | Breaking Points with Krystal and Saagar","Krystal and Saagar cover an attack on by a January 6th Capitol riot attendee at an FBI office that led to a shootout with police To ...","yA7B4a40GBo",144238,4052,0,1753
"442","BG66A7E1kyE",2022-06-22,"YouTube CENSORS Jan 6 Committee Claiming Misinformation | Breaking Points with Krystal and Saagar","Krystal and Saagar come out against YouTube censoring the Jan 6th committee because it claimed misinformation from one of ...","BG66A7E1kyE",113245,5373,0,962
"443","wD8F6mWCNSI",2022-05-05,"Dems Secretly FEAR Abortion Won&#39;t Save Them In 2022 | Breaking Points with Krystal and Saagar","Krystal and Saagar look at the political possibilities of abortion affecting midterm results for Democrats who are hoping that the ...","wD8F6mWCNSI",84525,2751,0,992
"444","3CY5hL8SVQg",2022-06-28,"Period Tracking App ADMITS They&#39;ll Send Data to Abortion Cops | Breaking Points","Krystal and Saagar parse through the data and privacy battles with tech apps, especially apps for period tracking, that will become ...","3CY5hL8SVQg",72976,2909,0,812
"445","ZV0RlxVTk1s",2022-08-16,"Krystal Ball: CHENEY Out &amp; PALIN Back? Primary Race Breakdown","Krystal breaks down the GOP primary in Wyoming where Liz Cheney will almost certainly be defeated and the special election in ...","ZV0RlxVTk1s",46654,1581,0,418
"446","aM-GkP5OTT4",2022-08-08,"CBS CAUGHT Editing Report On Arms Proliferation In Ukraine | Breaking Points with Krystal and Saagar","Krystal and Saagar give viewers a rundown of CBS News editing a documentary that reported on arms proliferation in Ukraine ...","aM-GkP5OTT4",109792,5490,0,872
"447","rLi1SUQunZQ",2022-04-12,"Krystal Ball: DIRE WARNING For Dems As France REJECTS Establishment","Krystal considers the parallels between the French elections and what midterms could look like here after voters in France ...","rLi1SUQunZQ",154391,4843,0,977
"448","17-E4be1ajk",2022-05-25,"McCormick SUES As RNC Backs OZ On Absentee Ballots | Breaking Points with Krystal and Saagar","Krystal and Saagar review the lawsuit by Dave McCormick to get the GOP mail in ballots without a listed date counted in PA ...","17-E4be1ajk",24766,828,0,90
"449","H-5RMBxEi-g",2022-06-09,"BREAKDOWN: Proud Boys INDICTED For Seditious Conspiracy | Breaking Points with Krystal and Saagar","Krystal and Saagar break down the DOJ indictments of the leaders of the Proud Boys extremist groups related to their activity on ...","H-5RMBxEi-g",64538,1814,0,981
"450","L-Y8Gh12ao0",2022-05-19,"Peter Zeihan: How Ukraine War, Demographics WILL END Globalization | Breaking Points","Krystal and Saagar bring geopolitical analyst and author Peter Zeihan onto Breaking Points for his insight on the Ukraine war, ...","L-Y8Gh12ao0",170168,7061,0,1306
"451","8Ca-nu2MPqo",2022-08-15,"GOP CONFUSED On Talking Points Post FBI Raid | Breaking Points with Krystal and Saagar","Krystal and Saagar examine the GOP divide on talking points about the Trump FBI raid now that more information has come out ...","8Ca-nu2MPqo",41831,1374,0,285
"452","BasIJSc1d3A",2022-04-28,"LEAKED AUDIO: Twitter Execs FREAK, CRY Over Musk Takeover | Breaking Points with Krystal and Saagar","Krystal and Saagar review the leaked audio of Twitter employees who privately freaked out about Musk's takeover to the point of ...","BasIJSc1d3A",153314,5529,0,748
