"","video_id","publishedAt","title","description","id","viewCount","likeCount","favoriteCount","commentCount"
"272","b6OfE96mgAw",2022-04-07,"Biden FLIP FLOPS On Support For Amazon Labor Union | Breaking Points with Krystal and Saagar","Krystal and Saagar take a look at the comments made by President Biden in support of the Amazon Labor Union that the ...","b6OfE96mgAw",73796,3101,0,488
"273","sVWLSQXxFj8",2022-07-28,"DETAILS: Dems ACTUALLY Might Pass Climate Bill, Corporate Tax Hike | Breaking Points","Krystal and Saagar break down for Breaking Points viewers the tax and climate agreement by Schumer and Manchin that could ...","sVWLSQXxFj8",91003,3120,0,1198
"274","DFE8JJb0jKM",2022-07-11,"EXPLAINED: What Shinzo Abe Assassination Means For Japans Future | Breaking Points","Krystal and Saagar bring Japan expert Tobias Harris onto Breaking Points to better understand the legacy of assassinated former ...","DFE8JJb0jKM",105829,3411,0,675
"275","trHH7xZ1krk",2022-04-12,"Philly BRINGS BACK Mask Mandates, Will It DOOM Dems? | Breaking Points with Krystal and Saagar","Krystal and Saagar cover the renewed mask mandate in Philadelphia and the chance Democrats nationally follow with more ...","trHH7xZ1krk",68899,2389,0,793
"276","qk2aMxpS-6o",2022-07-12,"Herschel Walker LIES About Secret Kids To His Own Staff | Breaking Points with Krystal and Saagar","Krystal and Saagar examine the stumbles of the Herschel Walker GOP Senate campaign from lying to staff about hidden children ...","qk2aMxpS-6o",69021,2348,0,613
"277","K7d011WYaLk",2022-01-11,"SHOTS FIRED: Dem Senator Moves To BAN Corrupt Stock Trading |Breaking Points with Krystal and Saagar","Krystal and Saagar cover the pending legislation from Georgia Democratic Senator Jon Ossoff that would ban lucrative insider ...","K7d011WYaLk",119707,6609,0,885
"278","WUj4_Wx0eKU",2022-08-11,"Ilhan Omar WINS Close Democratic Primary | Breaking Points with Krystal and Saagar","Krystal and Saagar review Ilhan Omar's Democratic primary victory and the Wisconsin GOP gubernatorial primary To become a ...","WUj4_Wx0eKU",37751,1049,0,267
"279","IujQF0V31D4",2022-05-08,"Top Bernie Aide DISHES On Rogan Endorsement Controversy | Krystal Kyle &amp; Friends Podcast","Krystal and Kyle talk to former top Bernie Sanders campaign aide Ari Rabin-Havt about the major inflection points in the campaign ...","IujQF0V31D4",194342,5646,0,1130
"280","cFA6vatsOhQ",2022-07-25,"Krystal Ball: HALF Of Americans Say Civil War IMMINENT","Krystal combs through the civil war discourse on the right and left particularly with partisan media viewers that represents deep ...","cFA6vatsOhQ",129621,5001,0,2668
"281","mtWBnQbCHj0",2022-06-02,"Jury REJECTS Amber Heard&#39;s Accusations Of Abuse | Breaking Points with Krystal and Saagar","Krystal and Saagar break down the results of the Johnny Depp- Amber Heard trial that saw jurors reject Heard's accusations of ...","mtWBnQbCHj0",150550,4796,0,2098
"282","OHBR-ibwF84",2022-06-13,"Does DeSantis HAVE A CHANCE Against Trump? | Breaking Points with Krystal and Saagar","Krystal and Saagar look at the rumblings about Ron DeSantis and other Republican hopefuls running against Trump for the 2024 ...","OHBR-ibwF84",105105,2833,0,1807
"283","7krel-5p1VA",2022-06-06,"Putin HITS Kiev In WARNING To West | Breaking Points with Krystal and Saagar","Krystal and Saagar give the news about Putin's strike on Kyiv for the first time since April in the Ukraine war as the West explores ...","7krel-5p1VA",89477,3048,0,1130
"284","UNSGJHPpKsM",2022-02-03,"Starbucks, Big Oil Caught Making BILLIONS Off Price Gouging |Breaking Points with Krystal and Saagar","Krystal and Saagar break down the statistics showing how large corporations from Starbucks to oil companies are making record ...","UNSGJHPpKsM",90171,4171,0,880
"285","8HNYrU1ARU8",2022-08-16,"WATCH: Dr OZ CRINGE Trip To Grocery Store | Breaking Points with Krystal and Saagar","Krystal and Saagar cringe at Dr. Oz's inauthentic attempt to be an everyman during a trip to the grocery store and provide an ...","8HNYrU1ARU8",72861,2551,0,623
"286","fQWpqybZeos",2021-09-13,"Biden, Pentagon LIED About Afghan Drone Strike Which MURDERED US Ally, Children","Krystal and Saagar cover the investigative report that proved Biden and the Pentagon lied about the final drone strike in ...","fQWpqybZeos",88849,5769,0,1138
"287","g4l6NhkjmOo",2021-09-23,"Saagar Enjeti: MSNBC&#39;s Joy Reid SMEARS Gabby Petito Online Sleuths","Saagar takes a look at the details of the Gabby Petito murder and how the mainstream media has responded to the online interest ...","g4l6NhkjmOo",234721,9303,0,2384
"288","x3ojqZvVudw",2022-08-02,"DeShaun Watson Suspension EXPOSES NFL Hypocrisy | Breaking Points with Krystal and Saagar","Krystal and Saagar point out the NFL's hypocrisy in its light suspension of start QB DeShaun Watson after 30 sexual assault ...","x3ojqZvVudw",80281,2375,0,922
"289","ObWwteDdQG0",2022-06-09,"Krystal and Saagar DEBATE McConaughey Gun Proposals | Breaking Points with Krystal and Saagar","Krystal and Saagar get into a long debate about the gun control proposals by star actor and Uvalde native Matthew McConaughey ...","ObWwteDdQG0",104787,4809,0,3818
"290","6X3DOeUJ5eE",2022-05-09,"BONO, Jill Biden, Trudeau VISIT Ukraine | Breaking Points with Krystal and Saagar","Krystal and Saagar look at the decision by First Lady Jill Biden to visit Zelensky in Ukraine alongside rock legend Bono and ...","6X3DOeUJ5eE",49933,1643,0,506
"291","Gx22jJypthw",2022-08-02,"EVERYTHING To WATCH In Primary Races Today | Breaking Points with Krystal and Saagar","Krystal and Saagar go through everything viewers need to watch ahead of the primary elections happening across America ...","Gx22jJypthw",69853,1970,0,469
"292","dBWJnFX7LiY",2022-05-25,"Krystal And Saagar DEBATE Gun Control | Breaking Points with Krystal and Saagar","Krystal and Saagar go back and forth on gun control after the renewed debate about gun policy stirred by the mass shootings in ...","dBWJnFX7LiY",191094,6722,0,5844
"293","vcsXl1VzqJc",2022-04-14,"Elon Makes HUGE Twitter Offer, Can He Save Free Speech? | Breaking Points with Krystal and Saagar","Krystal and Saagar along with Kyle and Marshall talk about the Elon Musk Twitter offer and ensuing saga live from New York City ...","vcsXl1VzqJc",122961,3940,0,826
"294","Bcq5YqCqagI",2022-02-10,"The VIEW Spews Anti-Vax Misinfo As Dem Policies Change | Breaking Points with Krystal and Saagar","Krystal and Saagar debunk the blatant covid misinformation being pushed by The View as the Democratic party grapples with the ...","Bcq5YqCqagI",325628,11575,0,2053
"295","8yR2Sxnm5_4",2022-08-01,"Jon Stewart SHREDS GOP For Tanking Burn Pits Bill | Breaking Points with Krystal and Saagar","Krystal and Saagar take viewers through Jon Stewart's exasperation at the GOP for suddenly opposing a bill to provide healthcare ...","8yR2Sxnm5_4",101345,4041,0,1556
"296","vk_Vu53mGw0",2022-06-07,"Biden CAVES To China Lobby On Solar Panels | Breaking Points with Krystal and Saagar","Krystal and Saagar are joined by executive editor of The American Prospect David Dayen to better understand the gift provided by ...","vk_Vu53mGw0",61112,2616,0,424
"297","-4RKZmeh6I0",2022-08-16,"Dems HAMMER GOP On Abortion As Republican Fundraising Sinks |Breaking Points with Krystal and Saagar","Krystal and Saagar break down the Democrats huge fundraising advantage over Republicans in the midterm elections and how ...","-4RKZmeh6I0",38770,1343,0,600
"298","4HQu__BCcgI",2022-08-01,"Are Pollsters Underrating GOP Chances AGAIN? | Breaking Points with Krystal and Saagar","Krystal and Saagar are joined by elections expert Kyle Kondik to get a better sense of the midterm landscape and whether polls ...","4HQu__BCcgI",50596,1540,0,305
"299","uSHvSCzRb5s",2022-04-19,"SHOCK POLL: Even Young Trump Voters BACK Amazon Union | Breaking Points with Krystal and Saagar","Krystal and Saagar examine the initial polling data showing that the Amazon Labor Union has overwhelming support from ...","uSHvSCzRb5s",60708,2617,0,852
"300","bEAaYyWfKJc",2022-06-17,"Saagar FUMES At Woke Alma Mater For Removing Mascot | Breaking Points with Krystal and Saagar","Krystal and Saagar go back and forth on Saagar's alma mater George Washington University removing its mascot after pressure ...","bEAaYyWfKJc",103869,3459,0,1972
"301","pRA6Q_3dR_w",2022-06-09,"Dems Bring In TV EXECS To Produce Primetime Jan 6 Hearings | Breaking Points with Krystal and Saagar","Krystal and Saagar look at the primetime January 6th committee hearings being produced by cable news execs spearheading the ...","pRA6Q_3dR_w",107047,3325,0,1497
"302","1ixkdOi_JlA",2022-03-21,"China BLAMES NATO For Ukraine Crisis, Increases Russia Ties |Breaking Points with Krystal and Saagar","Krystal and Saagar go through the tone shift from China on the Russian invasion of Ukraine as the CCP now blames NATO and is ...","1ixkdOi_JlA",92381,3383,0,1261
"303","j8C3c7T9a8k",2022-07-25,"SHOCK POLL: BETO Surges In TX Gov Race On Uvalde Fallout | Breaking Points with Krystal and Saagar","Krystal and Saagar explore the Texas Gov race between GOP incumbent Greg Abbott and Democratic challenger Beto O'Rourke ...","j8C3c7T9a8k",113568,3523,0,1186
"304","y5Om1y_SbSs",2022-02-01,"GOP 2022 Strategy: Run On NOTHING But Bashing Dems | Breaking Points with Krystal and Saagar","Krystal and Saagar cover the GOP leadership's plan to run a policy free midterm campaign centered around bashing Democrats ...","y5Om1y_SbSs",88542,3144,0,993
"305","UNielynRfU0",2022-04-18,"Ukraine SINKS Flagship As Russia Nears Biggest Victory Yet | Breaking Points with Krystal and Saagar","Krystal and Saagar give a battle update on the war between Russia and Ukraine as a major Russian warship sinks and the ...","UNielynRfU0",69669,2250,0,618
"306","0gPJzEvHo3o",2022-06-21,"Daniel Nichanian: Establishment CRUSHED In France As Right, Left Surge | Breaking Points","Krystal and Saagar bring elections analyst Daniel Nichanian back to Breaking Points to better understand the French ...","0gPJzEvHo3o",78870,2293,0,302
"307","Y9eBvFHagUk",2022-06-22,"Trump Jr BLASTS Texas GOP For Barring Gay Republicans | Breaking Points with Krystal and Saagar","Krystal and Saagar point out the Don Jr and Texas GOP fight over gay Republicans as a division within the party on gay rights ...","Y9eBvFHagUk",135617,4277,0,2526
"308","dwJotb4pf0w",2022-07-01,"Krystal and Saagar THROW DOWN Over European Lifestyle, Food | Breaking Points","Krystal and Saagar debate the European lifestyle and food after Saagar received criticism online for his thoughts on the issue To ...","dwJotb4pf0w",168472,7430,0,4635
"309","VV8E7da95q0",2022-08-06,"Krystal and Saagar DEBATE Seed Oils | Breaking Points with Krystal and Saagar","Krystal and Saagar talk about seed oils and the online discourse around them in response to an AMA question about it To ...","VV8E7da95q0",74572,2270,0,1178
"310","WlruVLZOsn0",2022-08-09,"DeSantis TAKES LEAD In Betting Markets After Trump Raid | Breaking Points with Krystal and Saagar","Krystal and Saagar show the betting markets with DeSantis in the lead for the 2024 GOP nomination after Trump was raided by ...","WlruVLZOsn0",54483,1514,0,383
"311","_1Vb0gcnt2I",2022-07-29,"Instagram COPIES TIKTOK With New Update | Breaking Points with Krystal and Saagar","Krystal and Saagar explain the significance of Instagram's new update being a copy of TikTok and the criticism it has received To ...","_1Vb0gcnt2I",88549,3028,0,654
"312","CHjNXtRpcxo",2022-03-10,"Anna Khachiyan: Russophobia Is The Latest Liberal Activism | Breaking Points with Krystal and Saagar","Krystal and Saagar are joined by cultural critic and podcast host Anna Khachiyan to better understand the Russophobia being ...","CHjNXtRpcxo",128226,4918,0,991
"313","1jzCsuCXloI",2022-06-16,"Biden Sends $1 BILLION More In Aid To Ukraine | Breaking Points with Krystal and Saagar","Krystal and Saagar scrutinize the decision by Biden to send $1 billion more in military aid to Ukraine after repeated requests from ...","1jzCsuCXloI",41931,1707,0,660
"314","jzQ8Vf1RShw",2022-06-16,"Krystal Ball: Biden PATHETIC Inflation Result Caused by DC Brain ROT","Krystal takes aim at Joe Biden's inaction on inflation caused by a lack of political imagination from a lifetime of buying into DC ...","jzQ8Vf1RShw",111418,4309,0,1332
"315","dIyw7pqI48k",2021-10-25,"Kyle Kondik: Can Obama RESCUE VA Dem From SHOCKING Defeat? | Breaking Points with Krystal and Saagar","Krystal and Saagar are joined by elections expert Kyle Kondik to talk about the strategies being used by both campaigns in the ...","dIyw7pqI48k",45877,1745,0,214
"316","UUKQs6O0dao",2022-06-18,"Peter Zeihan: Why Globalization is OVER | The Realignment Podcast","Saagar and Marshall talk with author and geopolitical strategist Peter Zeihan on the realignment podcast about why globalization ...","UUKQs6O0dao",53986,2278,0,452
"317","h3vBYPXo9ns",2022-05-02,"Chomsky Says TRUMP Only One Pushing Peace In Ukraine | Breaking Points with Krystal and Saagar","Krystal and Saagar respond to the comments made by Noam Chomsky in a recent interview where he labeled Donald Trump as ...","h3vBYPXo9ns",94465,2969,0,1159
"318","L9beI2kxnQM",2021-11-16,"STUDY: Dems Losing &#39;Normal&#39; Voters Of ALL Races | Breaking Points with Krystal and Saagar","Saagar and guest host Kyle Kulinski cover a new study that explains why Democrats are losing normal voters of all races despite ...","L9beI2kxnQM",113142,5833,0,915
"319","nHR7PrKh9bc",2022-08-07,"Political, Media Elites GASLIGHT On Third Parties | Breaking Points with Krystal and Saagar","Krystal and Saagar have commentator James Li make the case for third parties in response to gaslighting from political and ...","nHR7PrKh9bc",43605,2404,0,477
"320","X_P6EWd6po0",2022-06-09,"General UNDER INVESTIGATION For Illegal Qatar Lobbying | Breaking Points with Krystal and Saagar","Krystal and Saagar scrutinize the former top general under investigation for illegal lobbying for the Qatar government during his ...","X_P6EWd6po0",54177,2101,0,281
"321","dqF76pKG8kI",2022-06-15,"NFL Coach FINED $100K For Comparing Jan 6 to BLM Riots | Breaking Points with Krystal and Saagar","Krystal and Saagar weigh in on the decision by the Washington Commanders to fine Defense Coordinator Jack Del Rio 100K for ...","dqF76pKG8kI",98178,2849,0,1997
"322","2izbCtAlahM",2022-05-23,"Trump Poised For HUMILIATION As Brian Kemp Nears Victory | Breaking Points with Krystal and Saagar","Krystal and Saagar examine the Georgia GOP Gov. primary election where incumbent Brian Kemp is expected to win easily ...","2izbCtAlahM",74918,2126,0,596
"323","p_TKTgOln6o",2022-06-21,"Will Trump Endorse Accused Wife Beater With Psychotic &#39;RINO Hunting&#39; Ad? | Breaking Points","Krystal and Saagar criticize Missouri GOP Senate frontrunner Eric Greitens' 'RINO Hunting' ad that spurred controversy after he ...","p_TKTgOln6o",62641,2092,0,881
"324","tthtgJiuJQc",2022-06-16,"Americans HATE Journalists In New Poll | Breaking Points with Krystal and Saagar","Krystal and Saagar analyze the polling of journalists by Pew Research Center showing how their opinions differ from the ...","tthtgJiuJQc",75423,2827,0,977
"325","5AI1gbZiExw",2022-06-13,"Krystal Ball: The Left Case AGAINST Jan 6 Commission","Krystal makes the left case against prioritizing the Jan 6th commission by demonstrating how political violence and riots are a ...","5AI1gbZiExw",69099,3501,0,987
"326","qgwvJYEUURQ",2022-06-30,"Secret Service DENIES Key Trump Jan 6 Testimony | Breaking Points with Krystal and Saagar","Krystal and Saagar evaluate the secret service's response to Cassidy Hutchinson's testimony about Trump getting into a physical ...","qgwvJYEUURQ",97189,3059,0,1720
"327","NbPAWqSgXzQ",2022-07-11,"WH FEARS ACCIDENTAL Russian Strike On NATO | Breaking Points with Krystal and Saagar","Krystal and Saagar deliver an update on the war between Russia and Ukraine given the increased risk a Russian strike could ...","NbPAWqSgXzQ",75251,2533,0,898
"328","F4Bk_OpZheM",2022-05-10,"Feds File MASSIVE Suit Against Starbucks Union Busters | Breaking Points with Krystal and Saagar","Krystal and Saagar talk with two Starbucks workers and labor organizers about the massive lawsuit filed by the NLRB against the ...","F4Bk_OpZheM",34627,1645,0,186
"329","uqBj0Sy535Y",2022-05-30,"Kamala Calls For ASSAULT WEAPONS BAN | Breaking Points with Krystal and Saagar","Krystal and Saagar comment on the speech VP Kamala Harris gave at the funeral of a Buffalo shooting victim where she called for ...","uqBj0Sy535Y",77307,2475,0,2139
"330","dv6tZPbx02U",2022-06-02,"Top NFT Marketplace Exec CAUGHT INSIDER TRADING | Breaking Points with Krystal and Saagar","Krystal and Saagar look at the first instance of digital marketplace insider trading to be uncovered by lawmakers involving an NFT ...","dv6tZPbx02U",73990,2002,0,435
"331","GXX1JrZ4_O0",2022-06-13,"Congress Reaches GUN Deal: Everything You Need To Know | Breaking Points with Krystal and Saagar","Krystal and Saagar deliver everything you need to know about the bipartisan, filibuster proof gun legislation agreed upon in the ...","GXX1JrZ4_O0",75029,2159,0,922
"332","yGiNzgxeoNk",2022-04-05,"Fox News CONFRONTS Zelensky On Ukraine Neo-Nazi Battalion | Breaking Points with Krystal and Saagar","Krystal and Saagar offer their perspective on the comments made by Ukraine president Zelensky about the neo-nazi Azov ...","yGiNzgxeoNk",200812,6152,0,3539
"333","TSQWd4LQnbc",2022-05-28,"INSIDE Starbucks Harassment, Firing of Union Leaders | Breaking Points with Krystal and Saagar","Krystal and Saagar talk with Starbucks unionization leader Laila Dalton about how the company harassed her and then fired her ...","TSQWd4LQnbc",22830,1322,0,357
"334","CsvyEfIBvtA",2022-06-30,"NATO Goes On &#39;Combat Stance&#39; With Expansion, Troop Deployments | Breaking Points","Krystal and Saagar break down the NATO expansion and troop deployments announced by President Biden and allies at the ...","CsvyEfIBvtA",63964,2319,0,938
"335","bk43_rP5EHU",2022-05-12,"Ryan Grim: Left EATS ITS OWN In Warning To Progressives | Breaking Points with Krystal and Saagar","Krystal and Saagar are joined by journalist and commentator Ryan Grim who tells the story of a leftist campaign that self ...","bk43_rP5EHU",131131,4293,0,1257
"336","1R8HGnLlKcE",2022-06-21,"Russia Threatens NATO Amid Lithuania Blockade | Breaking Points with Krystal and Saagar","Krystal and Saagar break down the Lithuanian blockage of goods flowing to the Russian baltic enclave Kaliningrad to enforce EU ...","1R8HGnLlKcE",93889,3359,0,1534
"337","tN2j3BbOOUA",2022-04-16,"Georgia Reporter: What Media MISSED On Trump&#39;s GA Influence |Breaking Points with Krystal and Saagar","Krystal and Saagar are joined by Georgia based journalist Greg Bluestein to better understand the 2022 election forecast in GA ...","tN2j3BbOOUA",39094,1644,0,335
"338","buTAMNE6gCI",2022-05-19,"Will GOP PA Gov Nominee Cause CONSTITUTIONAL CRISIS? | Breaking Points with Krystal and Saagar","Krystal and Saagar focus on the primary victory by GOP candidate Doug Mastriano who could trigger a constitutional crisis if he ...","buTAMNE6gCI",55963,1804,0,701
"339","hXCvrl0u5jA",2022-05-09,"The Remarkably CLEAR Data On How Americans Feel About Roe | Breaking Points with Krystal and Saagar","Krystal and Saagar are joined by Gallup Editor-In-Chief Mohamed Younis to dive into the data on Roe vs Wade over the past 30 ...","hXCvrl0u5jA",39321,1439,0,615
"340","Vfe_QfTTNYU",2022-04-21,"Big Crypto THROWS MONEY At Dem Establishment | Breaking Points with Krystal and Saagar","Krystal and Saagar bring back journalist Ryan Grim to provide his coverage of crypto billionaire funding Nina Turner's opponent ...","Vfe_QfTTNYU",72842,3050,0,1084
"341","OGcRNhywSrU",2022-06-17,"How the FED Caused Inflation | Breaking Points with Krystal and Saagar","Krystal and Saagar have Marshall interview journalist Christopher Leonard to better understand the role played by the Fed in ...","OGcRNhywSrU",55449,1897,0,597
"342","BmAcnUDCKgc",2022-07-10,"Kyle Kulinski PRESSES Jordan Peterson On Trump Record | Krystal Kyle &amp; Friends","Kyle talks about the 2016 and 2020 general elections and Trump's record with Jordan Peterson in a wide ranging interview ...","BmAcnUDCKgc",219392,6785,0,4005
"343","TnPRmpgsFCE",2022-06-30,"Poll: 89% Of Ukrainians REJECT Peace With Russia | Breaking Points with Krystal and Saagar","Krystal and Saagar analyze the outlook on the Ukraine war given the strong support in Ukraine and Russia for keeping the war ...","TnPRmpgsFCE",45410,1403,0,813
"344","gmnDeDQJ5d8",2022-06-30,"SHOCK POLL: Dem Advantage EXPLODES After Roe | Breaking Points with Krystal and Saagar","Krystal and Saagar consider the polling data showing Democrats advantage on abortion is growing after Roe being overturned ...","gmnDeDQJ5d8",91540,2475,0,1199
"345","YwTfpNrmh1c",2022-06-26,"Jules Terpak: Will TikTok Get Banned? | Breaking Points with Krystal and Saagar","Krystal and Saagar have Marshall Kosloff interview TikTok creator and podcast host Jules Terpak to get her thoughts on banning ...","YwTfpNrmh1c",73007,2200,0,467
"346","KVR5YCqQ4MU",2022-02-03,"CNN Boss RESIGNS After Cuomo Linked SEX Scandal | Breaking Points with Krystal and Saagar","Krystal and Saagar deliver the news of CNN boss Jeff Zucker's shock resignation due to an affair he was having with a CNN ...","KVR5YCqQ4MU",135246,5092,0,726
"347","4D9i8_OvTw0",2021-06-22,"Krystal and Saagar: American Airlines Took BAILOUT BILLIONS, Fired Workers, Claims Labor Shortage","Krystal and Saagar analyze the situation unfolding at American Airlines and their supposed worker shortage. To become a ...","4D9i8_OvTw0",183788,10045,0,1645
"348","OrLjdqY3oZ4",2022-08-16,"DEEP DIVE: Will Biden Bill Bring Coal Country Jobs Back? | Breaking Points with Krystal and Saagar","Krystal and Saagar are joined by Washington Post reporter Jeff Stein to take a deep dive into how the climate provisions in ...","OrLjdqY3oZ4",28839,976,0,194
"349","vnOcj_gud3A",2022-06-13,"Trump BANS Jan 6 Talk From Truth Social | Breaking Points with Krystal and Saagar","Krystal and Saagar talk about the January 6th committee hearings aired in primetime and how Donald Trump responded to the ...","vnOcj_gud3A",80413,2616,0,1435
"350","vHKZd01vEm4",2022-07-12,"Biden STILL Beats Trump, Trump Beats DeSantis In Polls | Breaking Points with Krystal and Saagar","Krystal and Saagar consider the political ramifications of Biden still leading Trump in 2024 polls and Trump beating DeSantis with ...","vHKZd01vEm4",85761,2388,0,1448
"351","YwTfpNrmh1c",2022-06-26,"Jules Terpak: Will TikTok Get Banned? | Breaking Points with Krystal and Saagar","Krystal and Saagar have Marshall Kosloff interview TikTok creator and podcast host Jules Terpak to get her thoughts on banning ...","YwTfpNrmh1c",73007,2200,0,467
"352","OrLjdqY3oZ4",2022-08-16,"DEEP DIVE: Will Biden Bill Bring Coal Country Jobs Back? | Breaking Points with Krystal and Saagar","Krystal and Saagar are joined by Washington Post reporter Jeff Stein to take a deep dive into how the climate provisions in ...","OrLjdqY3oZ4",28839,976,0,194
"353","vnOcj_gud3A",2022-06-13,"Trump BANS Jan 6 Talk From Truth Social | Breaking Points with Krystal and Saagar","Krystal and Saagar talk about the January 6th committee hearings aired in primetime and how Donald Trump responded to the ...","vnOcj_gud3A",80413,2616,0,1435
"354","5BkEl2ZBheg",2021-12-13,"Donziger RELEASED After Breaking Points Pressure | Breaking Points with Krystal and Saagar","Krystal and Saagar cover the news that Steven Donziger has been released from prison and sent back home to serve out the rest ...","5BkEl2ZBheg",122737,7428,0,622
"355","vHKZd01vEm4",2022-07-12,"Biden STILL Beats Trump, Trump Beats DeSantis In Polls | Breaking Points with Krystal and Saagar","Krystal and Saagar consider the political ramifications of Biden still leading Trump in 2024 polls and Trump beating DeSantis with ...","vHKZd01vEm4",85761,2388,0,1448
"356","Y5xnIqpTPaM",2022-08-15,"DETAILS: These THREE Laws Possibly Violated By Trump | Breaking Points with Krystal and Saagar","Krystal and Saagar give the specifics on the Trump criminal probe by the DOJ and the laws he possibly violated by mishandling ...","Y5xnIqpTPaM",62957,1848,0,920
"357","bN2GhKCzeyY",2021-12-10,"DAILY POSTER: 6 LIES Media Is Telling On Inflation | Breaking Points with Krystal and Saagar","Krystal and Saagar talk to Daily Poster journalist Julia Rock about 6 myths being told to the public by the media about inflation as ...","bN2GhKCzeyY",150338,5696,0,1133
"358","fjpWHcxYQq0",2022-01-19,"Saagar Enjeti: NBA Owner, FB Billionaire Says &#39;I Don&#39;t Care&#39; About Chinese Genocide","Saagar issues a scathing critique of the Warriors co-owner and tech billionaire who downplayed China's Uighur genocide in what ...","fjpWHcxYQq0",196931,8404,0,2232
"359","VC0r_GpKvUU",2022-08-11,"REPORT: Trump Has FBI RAT In His Orbit | Breaking Points with Krystal and Saagar","Krystal and Saagar talk about the implications of the report about Trump having a rat who talked to the FBI in his inner orbit To ...","VC0r_GpKvUU",168948,4727,0,2467
"360","yhJ15oCV25g",2022-06-24,"Kamala Fundraiser CANCELED After Lack of Ticket Sales | The Kyle Kulinski Show","Kyle Kulinski comments on Kamala cancelling a fundraiser after a lack of ticket sales showing donors disinterest in the VP Krystal, ...","yhJ15oCV25g",93488,3252,0,726
"361","78p_kY23LIA",2022-08-16,"Gen Z CHEERS As Housing Prices Crash | Breaking Points with Krystal and Saagar","Krystal and Saagar examine data about how Americans would feel about a housing market crash without the blooper in the ...","78p_kY23LIA",122951,3738,0,1190
