"","video_id","publishedAt","title","description","id","viewCount","likeCount","favoriteCount","commentCount"
"182","coqCerwEx4c",2022-07-15,"Jon Stewart RESPONDS TO Calls For 2024 Run | Breaking Points with Krystal and Saagar","Krystal and Saagar look at how Jon Stewart responded to calls for him to run for President in 2024 because of his reach and ...","coqCerwEx4c",194707,5972,0,1679
"183","-BGyik9seu0",2022-05-03,"AOC Endorses Nina Turner TWELVE HOURS Before Election | Breaking Points with Krystal and Saagar","Krystal and Saagar break down the Nina Turner vs Shontel Brown House primary in Ohio's 11th district including the decision by ...","-BGyik9seu0",64468,2519,0,706
"184","hybOx48Kuls",2022-08-02,"Trump Endorses &#39;ERIC&#39; In Epic Troll Ahead Of MO Primary | Breaking Points with Krystal and Saagar","Krystal and Saagar explain how Trump trolled Missouri GOP voters with a strange non-endorsement ahead of a competitive ...","hybOx48Kuls",41231,1412,0,222
"185","TjADMjBHNRk",2022-03-10,"Colbert Says High Gas Prices Are PATRIOTIC DUTY | Breaking Points with Krystal and Saagar","Krystal and Saagar cover the liberal elite demand that Americans bear the cost of higher gas prices as a patriotic duty in response ...","TjADMjBHNRk",134615,4675,0,1686
"186","Gz2f8peN-4c",2022-07-25,"Russia Has Germany &#39;By The Balls&#39; On Natural Gas | Breaking Points with Krystal and Saagar","Krystal and Saagar analyze the effects of Russia re-opening the Nordstream 1 pipeline Germany relies on for natural gas To ...","Gz2f8peN-4c",64122,2538,0,762
"187","HaYgWkNdsGc",2022-06-20,"Krystal DESTROYS Inflation Talking Points On Bill Maher | Breaking Points with Krystal and Saagar","Krystal and Saagar talk about Krystal's appearance on Bill Maher's show that went super viral after she took down the inflation ...","HaYgWkNdsGc",418179,22645,0,5072
"188","da6yLBllY5o",2022-06-30,"POLL: Big Winner Of Jan 6 Hearings Is Ron DeSantis | Breaking Points with Krystal and Saagar","Krystal and Saagar consider what the Jan 6 hearings mean for Ron DeSantis and the challenge he could pose to Donald Trump ...","da6yLBllY5o",81756,2237,0,803
"189","72JbTnBS1ek",2022-04-18,"BIPARTISAN Stock Ban Progresses Thanks To Populist UPRISING |Breaking Points with Krystal and Saagar","Krystal and Saagar update viewers on the progress being made by a bipartisan coalition of lawmakers on a possible ban of ...","72JbTnBS1ek",72112,3393,0,364
"190","K3WCN6o1cOg",2022-07-14,"SHOCK MOMENT: John Bolton ADMITS Staging Coups On Behalf Of US | Breaking Points","Krystal and Saagar react to the shocking moment on CNN when longtime neocon John Bolton admitted to orchestrating coups in ...","K3WCN6o1cOg",90973,3045,0,597
"191","xmj-Q1gAFDY",2022-06-20,"FIRST Apple Store Unionizes As Retail Wave Spreads | Breaking Points with Krystal and Saagar","Krystal and Saagar cover the first unionization of an Apple store signifying the spread of the union wave among retail workers in ...","xmj-Q1gAFDY",51889,1895,0,362
"192","X5qWarQpaAE",2022-06-14,"Libs Push LIZ CHENEY For President | Breaking Points with Krystal and Saagar","Krystal and Saagar tear into the liberals pushing for Liz Cheney to run for President after her performance in the Jan 6th hearings ...","X5qWarQpaAE",109937,3485,0,1368
"193","TM9leZCle4U",2022-05-03,"EVERYTHING You Need to Know: SCOTUS To Overturn Roe v. Wade |Breaking Points with Krystal and Saagar","Krystal and Saagar provide viewers with fact vs fiction on the leaked draft opinion showing that SCOTUS is set to overturn the Roe ...","TM9leZCle4U",231287,8015,0,4317
"194","CAG4BKDjeqA",2022-06-06,"Dems PANIC Over John Fetterman Health Concerns | Breaking Points with Krystal and Saagar","Krystal and Saagar look at the lack of transparency and health concerns surrounding PA Dem Senate candidate John Fetterman ...","CAG4BKDjeqA",59547,1857,0,518
"195","PP8OllY8E2g",2022-07-11,"Biden BLAMES Abortion Activists For His Own Failures | Breaking Points with Krystal and Saagar","Krystal and Saagar question the Biden administration's finger pointing at abortion activists for his own failures to act on the issue ...","PP8OllY8E2g",62598,2373,0,491
"196","yP0HvZeS6PU",2022-07-07,"Bannon TRASHES Rogan For Refusing Trump Interview | Breaking Points with Krystal and Saagar","Krystal and Saagar discuss the sharp criticism from former Trump aide Steve Bannon directed towards Joe Rogan for not ...","yP0HvZeS6PU",178296,4885,0,1254
"197","edzZTva_MdI",2022-08-11,"Biden Celebrates &#39;ZERO Inflation&#39; Despite High Rent, Electricity | Breaking Points","Krystal and Saagar bring the latest inflation numbers and explain why Joe Biden is celebrating zero inflation despite continued ...","edzZTva_MdI",60362,1912,0,442
"198","tZ1Qee6NpeI",2022-06-28,"States in CHAOS Over Abortion Decision | Breaking Points with Krystal and Saagar","Krystal and Saagar examine the chaos of state abortion policy after Roe because some states have strong restrictions and others ...","tZ1Qee6NpeI",80503,2555,0,1040
"199","Mr8k_FQXMqw",2022-05-29,"Krystal and Saagar DEBATE Solutions to Gas Prices | Breaking Points with Krystal and Saagar","Krystal and Saagar go back and forth on the different solutions to the gas price issue that can be implemented to combat high ...","Mr8k_FQXMqw",65594,2435,0,1084
"200","1wPNvGv1b_o",2022-06-07,"Starbucks DECLARES WAR, Closes Union Store | Breaking Points with Krystal and Saagar","Krystal and Saagar scrutinize the decision by Starbucks to retaliate against union workers by closing a union store in an ...","1wPNvGv1b_o",55721,2363,0,737
"201","3DyAWNaqhsw",2022-07-25,"All But TEN Republicans Vote Against Contraception Right | Breaking Points with Krystal and Saagar","Krystal and Saagar examine the ramifications of Democrats forcing Republicans to vote on social issues previously decided by ...","3DyAWNaqhsw",78059,2614,0,1372
"202","8p1ut3aRvoQ",2022-05-09,"Russia GROUNDS Nuclear &#39;Doomsday Plane&#39; After Threats | Breaking Points with Krystal and Saagar","Krystal and Saagar cover the Russian WWII parade that was expected to be a chance for Putin to threaten the West that did not ...","8p1ut3aRvoQ",95349,2776,0,532
"203","5uvCZcFZf9w",2022-05-26,"INSANE Ballot Access Scandal UPENDS Michigan GOP Gov Race | Breaking Points with Krystal and Saagar","Krystal and Saagar discuss the widespread ballot counting fraud in the Michigan GOP Gov primary for the chance to face ...","5uvCZcFZf9w",75772,2628,0,680
"204","D49sFBwow5I",2022-07-28,"EXPLAINED: CHIPS Act PASSES As Bernie RAGES | Breaking Points with Krystal and Saagar","Krystal and Saagar explain the details of the CHIPS act meant to address US semiconductor manufacturing that passed the ...","D49sFBwow5I",137845,4903,0,1584
"205","C7BObYk1Nrw",2022-07-29,"Anti-Populist DISTRUST Of Fellow Citizens On The Rise | Breaking Points with Krystal and Saagar","Krystal and Saagar look deeper at the meaning of civil war discourse and troubling polling emerging that show a deep distrust ...","C7BObYk1Nrw",33418,1333,0,399
"206","qLojWB9rWws",2022-06-28,"Grill Dads Will Pay 36% MORE For July 4th BBQ | Breaking Points with Krystal and Saagar","Krystal and Saagar examine the ways inflation will impact the prices of basic goods to be used by grill dads during July 4th BBQ ...","qLojWB9rWws",68137,2328,0,569
"207","lCcORgUNE1U",2022-04-28,"Elon TRASHES Trump&#39;s Truth Social | Breaking Points with Krystal and Saagar","Krystal and Saagar evaluate the points made by Elon Musk about Trump's TRUTH social network and it's performance in the app ...","lCcORgUNE1U",113332,3683,0,537
"208","6l-o7aoARKI",2022-08-04,"MASSIVE GOP Cope After Losing Abortion Vote | Breaking Points with Krystal and Saagar","Krystal and Saagar respond to the GOP and pro-life cope about losing badly in the Kansas abortion vote To become a Breaking ...","6l-o7aoARKI",85264,2759,0,785
"209","DQgpekwysMs",2022-04-26,"McCarthy FALLS APART Over Trump Lies In Fox Interview | Breaking Points with Krystal and Saagar","Krystal and Saagar respond to Kevin McCarthy being pressed by Fox News on the lies he told them about comments he made ...","DQgpekwysMs",56766,2007,0,327
"210","Mzy1w8YvYUg",2022-08-02,"China Threatens Outright WAR OVER Pelosi Visit To Taiwan | Breaking Points with Krystal and Saagar","Krystal and Saagar respond to the outright threats from state sponsored Chinese commentators about war due to Pelosi's visit to ...","Mzy1w8YvYUg",157267,5077,0,1802
"211","LSnINiDt6kA",2022-06-17,"Google Engineer Claims AI Machine Has COME TO LIFE | Breaking Points with Krystal and Saagar","Krystal and Saagar try to make sense of the claim by a Google engineer that the company's artificial intelligence machine has ...","LSnINiDt6kA",136669,4373,0,1453
"212","GBS3u7BtIIA",2022-05-25,"Last Gasp Of Bush Dynasty CRUSHED In TX AG Primary | Breaking Points with Krystal and Saagar","Krystal and Saagar talk about the Texas AG primary on the GOP side that saw the last member of the Bush political dynasty lose ...","GBS3u7BtIIA",33671,1206,0,151
"213","Ge4Uvcl2LM4",2022-06-27,"Saagar Enjeti: Dave Portnoy TURNS On GOP For Roe. Will It Matter?","Saagar looks at the backlash to the GOP's abortion stance from Barstool founder Dave Portnoy reflecting the shifts in 'Barstool ...","Ge4Uvcl2LM4",110445,3597,0,1220
"214","gMOcvQFS6MA",2022-05-19,"Trump Tells OZ DECLARE VICTORY Ahead Of Election Recount | Breaking Points with Krystal and Saagar","Krystal and Saagar break down the Pennsylvania GOP Senate race between Dr. Oz and Dave McCormick that is headed to a ...","gMOcvQFS6MA",74295,2135,0,495
"215","7xqXRCUIjgw",2022-07-26,"Trump TRASHES Fox News As They Air DeSantis Propaganda | Breaking Points with Krystal and Saagar","Krystal and Saagar look at the tension between Donald Trump and Fox News as the network airs propaganda videos promoting a ...","7xqXRCUIjgw",71722,2106,0,674
"216","5wThXgiwjys",2022-05-02,"CRINGIEST White House Correspondents Dinner Moments | Breaking Points with Krystal and Saagar","Krystal and Saagar provide the most notable cringeworthy moments from the White House Correspondents Dinner from the DC ...","5wThXgiwjys",163030,5767,0,1408
"217","OrVqFj0vPjs",2022-05-25,"DEM CIVIL WAR: TOO CLOSE TO CALL In Cisneros-Cuellar Runoff |Breaking Points with Krystal and Saagar","Krystal and Saagar provide the figures on the super close Dem primary fight between the establishment incumbent Rep. Cuellar ...","OrVqFj0vPjs",50925,1710,0,303
"218","5NWdjRllP7Q",2022-07-12,"Trump Poised To Endorse NUTJOB In MO Senate Race | Breaking Points with Krystal and Saagar","Krystal and Saagar consider whether Trump is set to endorse scandal plagued Eric Greitens in the Missouri GOP Senate primary ...","5NWdjRllP7Q",41658,1397,0,428
"219","YfJ8VV3II8U",2022-06-27,"CIA Operatives, NATO Troops ON GROUND In Ukraine | Breaking Points with Krystal and Saagar","Krystal and Saagar cover the battle updates from Ukraine's fight against Russia in the Donbas region and the presence of CIA ...","YfJ8VV3II8U",97586,3231,0,923
"220","H10i9-iNeak",2022-05-06,"Bernie FLAMES Dems Giving Corporate Tax Breaks | Breaking Points with Krystal and Saagar","Krystal is joined by journalist Julia Rock of THE LEVER to better understand the corporate tax breaks in Senate legislation that ...","H10i9-iNeak",58587,2676,0,514
"221","mo4vLqCsF5c",2022-08-18,"Maddow Replacement FAILS On Very First Day | Breaking Points with Krystal and Saagar","Krystal and Saagar bring viewers the teleprompter mistake and low ratings from Rachel Maddow's replacement debut on MSNBC ...","mo4vLqCsF5c",150445,4843,0,917
"222","kQcjMSYyCkc",2022-07-14,"Europe Warns Of Ukraine Black Market Arms FLOODING Conflict Zones | Breaking Points","Krystal and Saagar break down the growing warnings out of Europe about the Ukrainian weapons ending up in black markets and ...","kQcjMSYyCkc",81369,2902,0,807
"223","fo8L8pzUy3Q",2022-05-16,"Krystal and Saagar Say THANK YOU For 800K Subscribers! | Breaking Points with Krystal and Saagar","Krystal and Saagar say thank you to the Breaking Points community for getting the show to 800K subscribers in less than a year ...","fo8L8pzUy3Q",66808,3402,0,387
"224","oTxjgVcKqeg",2022-06-27,"Pence Calls For NATIONAL ABORTION BAN | Breaking Points with Krystal and Saagar","Krystal and Saagar respond to the call by former VP Mike Pence for a national abortion ban after Roe was overturned despite its ...","oTxjgVcKqeg",62761,1928,0,825
"225","tIK48c3DCCg",2022-02-15,"AOC SILENT On Pelosi Leadership, Warns Of &#39;Jim Crow&#39; Return |Breaking Points with Krystal and Saagar","Krystal and Saagar offer their perspective on AOC's comments about Nancy Pelosi's leadership in the house and her belief that ...","tIK48c3DCCg",179588,6995,0,1788
"226","yOJctiGlIxs",2022-07-05,"DATA Proves Corporate Price Gouging | Breaking Points with Krystal and Saagar","Saagar is joined by the Roosevelt Institute's Director of Corporate Power Niko Lusiani to better understand statistics showing how ...","yOJctiGlIxs",71113,2848,0,480
"227","Yj4GcPQJEns",2022-03-22,"Post Pandemic Boomers FEAST While Millennials Starve | Breaking Points with Krystal and Saagar","Krystal and Saagar examine the growing generational wealth gap between Baby Boomers and Millennials exacerbated by covid ...","Yj4GcPQJEns",130594,4790,0,2432
"228","_lzb-buTemA",2022-08-15,"Trump SURGES In GOP Polls After Raid | Breaking Points with Krystal and Saagar","Krystal and Saagar go into the initial polling showing stronger GOP support for Trump after the FBI raid on his residence To ...","_lzb-buTemA",59082,1763,0,841
"229","VhzVw48VS7g",2022-04-02,"Fox News TEARS: Will Anyone Think of Ultra-Rich??? | Breaking Points with Krystal and Saagar","Krystal and Saagar criticize Fox News' coverage of the Biden administration's proposed billionaires tax where they came to the ...","VhzVw48VS7g",69613,3019,0,754
"230","Q8L2zBCbmCY",2022-06-11,"Biden HIKES Medicare Prices, Insurers Reap Profits | Breaking Points with Krystal and Saagar","Krystal talks with The Lever journalist Matthew Cunningham Cook about the Biden administration's Medicare price hike that will ...","Q8L2zBCbmCY",82484,3659,0,1010
"231","FOVA9UDLjkk",2021-10-21,"&#39;You Dumb Mother F*****&#39;: Joe Rogan RESPONDS To Don Lemon | Breaking Points with Krystal and Saagar","Krystal and Saagar respond to the latest comments by Joe Rogan towards CNN's coverage of him, particularly his choice words ...","FOVA9UDLjkk",2751254,98441,0,12857
"232","CLZi_0l1GGk",2021-10-18,"John Deere&#39;s EPIC Failure To Shut Down Worker Uprising | Breaking Points with Krystal and Saagar","Krystal and Saagar break down the reasons for rank and file John Deere workers striking and they put the labor action happening ...","CLZi_0l1GGk",94337,4604,0,630
"233","UCFo0JC8ppk",2022-04-26,"Saudi Prince HUMILIATES Biden Advisor | Breaking Points with Krystal and Saagar","Krystal and Saagar scrutinize the humiliating confrontation between Biden national security advisor Jake Sullivan and Saudi ...","UCFo0JC8ppk",117936,4197,0,1066
"234","1PlUf7tqq6A",2021-11-26,"Fauci GASLIGHTS On Gain of Function Research | Breaking Points with Krystal and Saagar","Krystal and Saagar respond to the comments made by Dr. Anthony Fauci where he downplays the importance of gain of function ...","1PlUf7tqq6A",140539,9099,0,1104
"235","_aGFaNSkjOY",2022-04-19,"Airline, Train Mask Mandates DEAD | Breaking Points with Krystal and Saagar","Krystal and Saagar break the news that mask mandates for travel have been overturned by a court judge and that private ...","_aGFaNSkjOY",67860,2731,0,910
"236","k5nqwpzKCiw",2022-03-15,"Biden Blames ALL INFLATION On Putin | Breaking Points with Krystal and Saagar","Krystal and Saagar present the newest polling on Joe Biden as the President and Democrats harden their midterm messaging ...","k5nqwpzKCiw",77265,2424,0,681
"237","f3FDlhJZegU",2022-05-31,"REPORT: Putin Possibly Has Terminal Cancer | Breaking Points with Krystal and Saagar","Krystal and Saagar evaluate the merits of the reporting about Russian autocrat Vladimir Putin having terminal cancer giving him ...","f3FDlhJZegU",145881,3718,0,1014
"238","EHJZABfpbms",2022-06-09,"ANALYSIS: Why SF Voters FIRED Chesa Boudin | Breaking Points with Krystal and Saagar","Krystal and Saagar are joined by journalist and author Ross Barkan to discuss the San Francisco recall of soft on crime District ...","EHJZABfpbms",109159,3677,0,1167
"239","mJRSXi27X9A",2022-06-07,"Elon Opens Door To DITCH Twitter Takeover | Breaking Points with Krystal and Saagar","Krystal and Saagar break down the growing dispute between Elon Musk and Twitter about bot counts that could be Musk's way ...","mJRSXi27X9A",100918,2975,0,858
"240","8t9TKsyMaWk",2022-04-19,"Russia Launches NEW MAJOR Offensive, Boosts Troops | Breaking Points with Krystal and Saagar","Krystal and Saagar break down the latest battle updates from Ukraine as Russia launches a new offensive in the eastern Donbass ...","8t9TKsyMaWk",76473,2357,0,654
"241","ttsvwsMBrkk",2022-07-12,"Dr Oz FLAILING As Fetterman Pounds Him For Carpetbagging | Breaking Points with Krystal and Saagar","Krystal and Saagar update viewers on the Pennsylvania Senate battle between Republican Dr Oz and Democrat John Fetterman ...","ttsvwsMBrkk",135068,4377,0,1034
"242","qZT5Dm4Sn6o",2022-07-28,"FINALLY: Biden Moves To Combat Gas Prices | Breaking Points with Krystal and Saagar","Krystal and Saagar deliver good news about the Biden administration finally doing something about gas prices after months of ...","qZT5Dm4Sn6o",69016,2345,0,600
"243","uc-OJvo8PZ4",2022-05-20,"Dem Voters Show DISGUST For Establishment in Primary Defeats | Breaking Points","Krystal talks with The Lever journalist David Sirota about the primary results that featured progressive wins against the ...","uc-OJvo8PZ4",75808,3288,0,658
"244","ZPoqZJuYcQ0",2021-12-21,"INSIDE BIPARTISAN Push To INVESTIGATE Amazon&#39;s Abuse | Breaking Points with Krystal and Saagar","Krystal and Saagar break down the significance of the bipartisan coalition forming to fight the dangerous working conditions faced ...","ZPoqZJuYcQ0",79614,2995,0,241
"245","zYO1ZCqI0aw",2022-06-27,"Liz Cheney BEGS Dems To Bail Her Out | Breaking Points with Krystal and Saagar","Krystal and Saagar talk about Liz Cheney's desperate begging of Wyoming Democrats to switch parties and vote for her in the ...","zYO1ZCqI0aw",103730,3317,0,738
"246","_6UglM-Ba9E",2022-08-02,"Kansas Voters FIRST To Decide On Abortion Post-Roe | Breaking Points with Krystal and Saagar","Krystal and Saagar consider the possibilities of Kansas' abortion referendum that will be voted on tonight To become a Breaking ...","_6UglM-Ba9E",33228,1041,0,432
"247","JN1gQst3r7M",2022-08-04,"China FIRES MISSILES Into Taiwanese, Japanese Waters After Pelosi Visit | Breaking Points","Krystal and Saagar examine the ramifications of Nancy Pelosi's trip to Taiwan that led to China firing missiles in Taiwan and ...","JN1gQst3r7M",138844,4965,0,1472
"248","NCIHB2RejCc",2022-06-27,"Johnson PRESSES France To Reject Ukraine Peace | Breaking Points with Krystal and Saagar","Krystal and Saagar provide their commentary on British Prime Minister Boris Johnson's insistence to French President Macron that ...","NCIHB2RejCc",66294,2019,0,520
"249","L0qQSpybve8",2022-05-05,"The TRUMP Effect: JD Vance WINS In Ohio GOP Primary | Breaking Points with Krystal and Saagar","Krystal and Saagar consider the influence that Trump's endorsement had on the Ohio GOP primary victory for JD Vance in his ...","L0qQSpybve8",63254,1827,0,408
"250","AkT53Dh9WDw",2022-04-28,"Krystal And Saagar DEBATE Student Debt Cancellation | Breaking Points with Krystal and Saagar","Krystal and Saagar have an extended debate about student debt cancellation on a political level and on the policy proposals ...","AkT53Dh9WDw",107316,3969,0,2981
"251","LYxwo_7H7-k",2022-05-26,"DELUSIONAL Pence Looks To Take On Trump In 2024 | Breaking Points with Krystal and Saagar","Krystal and Saagar look at the rumors of Pence running against Trump in the 2024 GOP primary and criticize those who believe ...","LYxwo_7H7-k",58797,1777,0,427
"252","dXjvizIPsfM",2022-08-09,"GOP THREATENS INVESTIGATION Of FBI, Merrick Garland | Breaking Points with Krystal and Saagar","Krystal and Saagar consider the implications of GOP leadership pledging to investigate AG Merrick Garland and the FBI in ...","dXjvizIPsfM",77066,2231,0,961
"253","lalOWrMTSyA",2022-05-05,"Nina Turner LOSES: Abandoned By Progressives | Breaking Points with Krystal and Saagar","Krystal and Saagar break down Nina Turner's defeat in the Ohio Democratic primary for the 11th congressional district after ...","lalOWrMTSyA",97153,3193,0,1509
"254","2vLeGFs2g_8",2022-06-14,"James Li: EXPOSING Hidden Forces Jacking Up Gas Prices | Breaking Points with Krystal and Saagar","Krystal and Saagar talk with political commentator James Li about the hidden market forces leading to higher gas prices being ...","2vLeGFs2g_8",68043,2824,0,488
"255","Jphm1TT0fns",2021-12-23,"Saagar Enjeti: Reviewing My WORST Predictions Of 2021","Saagar looks back on all of the predictions he made in 2021 to find his takes that aged the poorest and what he got right in the ...","Jphm1TT0fns",129146,7904,0,1140
"256","YHk7lEB4B9c",2022-07-19,"Andrew Yang FLOATS Matthew McConaughey For President | Breaking Points with Krystal and Saagar","Krystal and Saagar talk about the possibility of an independent candidate running for President after Andrew Yang suggested ...","YHk7lEB4B9c",93670,2711,0,1114
"257","95mpqe8vwJc",2022-04-23,"Boston Marathon BANS Russian, Belarus Athletes | Breaking Points with Krystal and Saagar","Krystal and Saagar bring an update on the Russophobia on display in elite institutions such as the Boston Marathon who banned ...","95mpqe8vwJc",54123,2453,0,971
"258","zRscCCSHOwU",2022-06-27,"Derek Thompson: Airline Cancellations EXPLODE Despite $50 Billion Bailout | Breaking Points","Krystal and Saagar bring writer from The Atlantic Derek Thompson back to Breaking Points to better understand the mass airline ...","zRscCCSHOwU",98067,3257,0,662
"259","fnj1oCRU7q0",2022-08-01,"Manchin PLEADS With Sinema Not To Tank Climate Bill | Breaking Points with Krystal and Saagar","Krystal and Saagar present Joe Manchin's comments towards Kyrsten Sinema about the Dems climate agreement that she could ...","fnj1oCRU7q0",63229,2024,0,598
"260","2h1qqV83XlA",2022-08-01,"Even NEWSMAX Skeptical Of GOP Talking Points On Burn Pits | Breaking Points with Krystal and Saagar","Krystal and Saagar review the conservative network Newsmax's interview with Jon Stewart where they asked him about GOP ...","2h1qqV83XlA",32471,1387,0,193
"261","w0d5WN-9XE0",2022-04-26,"YEAH RIGHT: Trump Says NEVER Coming Back To Twitter | Breaking Points with Krystal and Saagar","Krystal and Saagar question the claim by Trump that he will not return to Twitter now that Elon Musk owns the platform and would ...","w0d5WN-9XE0",48635,1497,0,304
"262","CFjZKzBhrdI",2022-08-02,"BREAKING: Biden Announces Al Qaeda Terrorist Leader Killed In Drone Strike | Breaking Points","Krystal and Saagar cover the Biden administration's announcement that a top Al Qaeda leader who played a key role in plotting ...","CFjZKzBhrdI",86139,2686,0,797
"263","CSwh810W48k",2022-08-08,"Lindsey Graham SPUTTERS On Gay Marriage Vote | Breaking Points with Krystal and Saagar","Krystal and Saagar cover Lindsey Graham being pressed on CNN about his views on gay marriage as Democrats try to rally GOP ...","CSwh810W48k",52204,1704,0,518
"264","QFkI4KiLNcQ",2022-08-08,"How Sinema BAILED OUT Private Equity Billionaires At Last Minute | Breaking Points","Krystal and Saagar kick off this week of Breaking Points by breaking down the Democrats budget legislation and how Sinema ...","QFkI4KiLNcQ",70507,2690,0,779
"265","-lGMtumMgbI",2022-08-18,"Literally EVERYONE Hates Jared Kushner&#39;s New Book | Breaking Points with Krystal and Saagar","Krystal and Saagar review the criticism of Jared Kushner's new book coming everywhere from the NYT to former Trump advisers ...","-lGMtumMgbI",60972,1867,0,426
"266","CFpKXKlScyk",2022-04-12,"Gen Z Depression SKYROCKETS,  Many Possible Reasons Why | Breaking Points with Krystal and Saagar","Krystal and Saagar show the updated government statistics on youth sadness and depression and consider some of the reasons ...","CFpKXKlScyk",78190,2976,0,1117
"267","zRntKy7Z-J8",2022-05-12,"Squad FALLS IN LINE For BILLIONS More In Weapons To Ukraine |Breaking Points with Krystal and Saagar","Krystal and Saagar look at the vote to send $40 billion more in Ukraine aid that took place in the House as the Squad fell in line ...","zRntKy7Z-J8",82703,3246,0,1266
"268","ChEpq5W5Y6E",2022-02-13,"Chelsea Clinton SMEARS Substack Writers As Grifters | Breaking Points with Krystal and Saagar","Krystal and Saagar respond to the smears of Substack writers by Chelsea Clinton, whose entire life has been built around her ...","ChEpq5W5Y6E",131608,7000,0,956
"269","9reK4gJ7Y1w",2022-04-25,"EXCLUSIVE FOOTAGE: Bernie, AOC Rally With Amazon Workers | Breaking Points with Krystal and Saagar","Krystal and Saagar provide exclusive interviews of Amazon workers at the rally attended by Bernie and AOC ahead of the next ...","9reK4gJ7Y1w",40042,2000,0,394
"270","dOyRf_L01W4",2022-06-19,"Oil Markets REVEAL Rot In American Economy | Breaking Points with Krystal and Saagar","Krystal and Saagar have James Li break down oil markets even further and explain why it is part of a larger rot in the American ...","dOyRf_L01W4",99351,5197,0,994
"271","SkeyiGM_YsU",2022-03-29,"Biden Floats BILLIONS More In Defense Budget | Breaking Points with Krystal and Saagar","Krystal and Saagar cover the Biden budget proposal featuring billions more in spending on defense with the justification being the ...","SkeyiGM_YsU",40781,1563,0,371
